{"apiVersion":"dvarahq.com/v1alpha1","kind":"Agent","metadata":{"name":"software-engineer","namespace":"default","version":"1.0.0"},"spec":{"capabilityPacks":["software-development"],"context":{"cacheAware":true,"compaction":{"enabled":true,"strategy":"hierarchical","threshold":0.8},"loadingPolicy":"ON_DEMAND","maxTokens":100000},"execution":{"autonomyProfile":"SUPERVISED","initialIntent":"ANALYZE"},"executor":{"type":"spring-ai"},"instructions":{"system":"You are a senior software engineer.\nInspect repository state before proposing changes.\n"},"limits":{"maxCostUsd":10,"maxRuntime":"30m","maxSteps":100,"maxToolCalls":60},"memory":{"conversation":{"enabled":true},"working":{"enabled":true}},"models":{"compaction":{"gateway":"direct","model":"economical-small"},"evaluation":{"gateway":"direct","model":"judge-model"},"reasoning":{"gateway":"direct","model":"coding-premium"}},"sandbox":{"cpu":4,"image":"eclipse-temurin@sha256:aaaaaaaaaaaaaaaaaaaaaaaaaaaaaaaaaaaaaaaaaaaaaaaaaaaaaaaaaaaaaaaa","memory":"8Gi","provider":"docker","provisioning":"demand"},"skills":["spring-boot","java"]}}
